<?xml version="1.0" encoding="UTF-8"?>
<Zahtev xmlns="http://www.ftn.uns.ac.rs/a1"
        xmlns:xsi="http://www.w3.org/2001/XMLSchema-instance"
        xsi:schemaLocation="http://www.ftn.uns.ac.rs/a1 a1schema.xsd">
    <Podnosilac xmlns:a1="http://www.ftn.uns.ac.rs/a1" xsi:type="a1:TFizicko_lice">
        <Adresa>
            <Ulica>Ulica0</Ulica>
            <Broj>50</Broj>
            <Mesto>Mesto0</Mesto>
            <Postanski_broj>25500</Postanski_broj>
        </Adresa>
        <Kontakt>
            <Broj_telefona>Broj_telefona0</Broj_telefona>
            <Email>Email0</Email>
            <Faks>Faks0</Faks>
        </Kontakt>
        <Ime>Ime0</Ime>
        <Prezime>Prezime0</Prezime>
        <Drzavljanstvo>Drzavljanstvo0</Drzavljanstvo>
    </Podnosilac>
    <Autor>
        <Lice>
            <Adresa>
                <Ulica>Ulica1</Ulica>
                <Broj>50</Broj>
                <Mesto>Mesto1</Mesto>
                <Postanski_broj>25500</Postanski_broj>
            </Adresa>
            <Kontakt>
                <Broj_telefona>Broj_telefona1</Broj_telefona>
                <Email>Email1</Email>
                <Faks>Faks1</Faks>
            </Kontakt>
            <Ime>Ime1</Ime>
            <Prezime>Prezime1</Prezime>
            <Drzavljanstvo>Drzavljanstvo1</Drzavljanstvo>
        </Lice>
        <Pseudonim_autora>Pseudonim_autora0</Pseudonim_autora>
        <Godina_smrti>2006</Godina_smrti>
        <Autor_anoniman>false</Autor_anoniman>
    </Autor>
    <Punomocnik>
        <Ime>Ime2</Ime>
        <Prezime>Prezime2</Prezime>
        <Adresa>
            <Ulica>Ulica2</Ulica>
            <Broj>50</Broj>
            <Mesto>Mesto2</Mesto>
            <Postanski_broj>25500</Postanski_broj>
        </Adresa>
    </Punomocnik>
    <Delo>
        <Naslov_dela>Naslov_dela0</Naslov_dela>
        <Alternativni_naslov>Alternativni_naslov0</Alternativni_naslov>
        <Delo_prerade>
            <Naslov_izvornog_dela>Naslov_izvornog_dela0</Naslov_izvornog_dela>
            <Autor>
                <Lice>
                    <Adresa>
                        <Ulica>Ulica3</Ulica>
                        <Broj>50</Broj>
                        <Mesto>Mesto3</Mesto>
                        <Postanski_broj>25500</Postanski_broj>
                    </Adresa>
                    <Kontakt>
                    </Kontakt>
                    <Ime>Ime3</Ime>
                    <Prezime>Prezime3</Prezime>
                    <Drzavljanstvo>Drzavljanstvo2</Drzavljanstvo>
                </Lice>
                <Pseudonim_autora>Pseudonim_autora1</Pseudonim_autora>
                <Godina_smrti>2006</Godina_smrti>
                <Autor_anoniman>false</Autor_anoniman>
            </Autor>
        </Delo_prerade>
        <Vrsta_autorskog_dela>Vrsta_autorskog_dela0</Vrsta_autorskog_dela>
        <Forma_zapisa>Forma_zapisa0</Forma_zapisa>
        <Delo_stvoreno_u_radnom_odnosu>false</Delo_stvoreno_u_radnom_odnosu>
        <Nacin_koriscenja_dela>Nacin_koriscenja_dela0</Nacin_koriscenja_dela>
    </Delo>
    <Popunjava_zavod>
        <Opis_dela>Opis_dela0</Opis_dela>
        <Broj_prijave>Broj_prijave0</Broj_prijave>
        <Datum_podnosenja>2006-05-04</Datum_podnosenja>
    </Popunjava_zavod>
</Zahtev>
